{"correlation":{"capability_profile":["python"],"contract_ids":[],"entity_count":1,"finding_ids":[],"language_families":["python"],"related_test_count":0},"event_id":"feedback_event_47c1ab47c61b61c593d3a7ffa15dfa6978d5b861dce001b659072068ad47eb79","event_type":"resolution_succeeded","failure":{"attempt_number":1,"category":"test_failure","confidence_bucket":"low","fingerprint":"failure_9477f20227cba3e7146b0978cbcb0073a857df5fbaa311eee55584ad88fa2a6d","observed_fingerprint_changed":null,"repeated":false},"idempotency_key":"feedback_idempotency_47c1ab47c61b61c593d3a7ffa15dfa6978d5b861dce001b659072068ad47eb79","limitations":[],"occurred_at":"2026-09-01T19:14:29.480252Z","provenance":{"attempt_id_hash":"335330b1c1ff5bd732cd75a34eab65477ae9981a4026246e756da577b4643769","classification_id_hash":"1c6fc951ce11b337f64c10caa62b93e6ff8ce96e45010b1555ea0c3cbe028729","evidence_id_hashes":["bede0afc9d2dfc11b2fab7d953343361377cca601ad8cb49a76e2e947ab0f1fb"],"remediation_plan_id_hash":"123624aefbba485c59cdc7506de5702dc68afa5225c42cc2e3b2250501201ab3","rerun_id_hash":"9c036ba19a7e59c589395868b52c0eaf5ac4599e771977589e6226cdff58ffdd","snapshot_id_hash":"79c6d61344be00e74b64db50b5b9639bbfd2d845d2d686ec380526eb898a9d8a"},"provider":"github_actions","repository_pseudonym":"repository_32289afd9ccc6995c2f15a4ea396f6e294e3d1e0a1d794010f7c015384fe68bc","resolution":{"changed_file_count":1,"changed_line_bucket":"1_10","remediation_class":"bounded_source","remote_push_performed":true,"rerun_observed":true,"terminal_state":"clean"},"resolver_version":"0.6.0","schema_version":"l9.intelligence-feedback-event/v1","validation":{"duration_bucket":"10_60s","graph_delta_accepted":true,"result":"passed","result_id_hash":"e7196fa5c45367f8f7eb435c86a980def8341ce2c5a68dc3774decf693b01b00","step_count":4}}
